,Hotel_name,name,rating,review,label,review_tokens
0,Hotel Gran Mahakam,Robert Gow,4.0,old boutique hotel but very well maintained reception concierge restaurant housekeeping and security staff all very polite and helpful in room amenities are complete i stayed in a standard room then later upgraded to deluxe suite and found the bedding in both very comfortable there were insufficient number of power outlets accommodate my laptop and chargers for tablet and phone so i purchased a cable extension at the block m mall which is conveniently located meters from the hotel i can highly recommend the gran mahakam hotel for both business and family travel,Positif,old boutique hotel well maintained reception concierge restaurant housekeeping security staff polite helpful room amenities complete stayed standard room later upgraded deluxe suite found bedding comfortable insufficient number power outlets accommodate laptop chargers tablet phone purchased cable extension block mall conveniently located meters hotel highly recommend gran mahakam hotel business family travel
1,Hotel Gran Mahakam,Oggi Gunadi,5.0,outstanding service from the first sight first impression was made by security valet and bell boy who greet us and assist our luggage door girl greet and escort to reception and staff were professionally manner with their smile during assistance found the room was well maintain and sanitized label are placed it creates comfort during the stay oggihotelreview,Positif,outstanding service first sight first impression made security valet bell boy greet us assist luggage door girl greet escort reception staff professionally manner smile assistance found room well maintain sanitized label placed creates comfort stay oggihotelreview
2,Hotel Gran Mahakam,Fifi Muliadi,5.0,when i was working i frequently visited the hotel for meeting doing lunches and dinners i have always like this very specialized boutique hotel and i had my wedding reception there as well handled by hadi praja everything was on point fantastic from check in to wedding reception until check out with my guests all praising the good food and great valet service the only complaint from them is the access to the hotel on a saturday night was heavy traffic thank you gran mahakam,Positif,working frequently visited hotel meeting lunches dinners always like specialized boutique hotel wedding reception well handled had praja everything point fantastic check wedding reception check guests praising good food great valet service complaint access hotel saturday night heavy traffic thank gran mahakam
3,Hotel Gran Mahakam,Renatha P,5.0,having all you can eat luncheon in private room for pax with round table fine dining with good services and friendly staff helping taking pictures of us rooms service location more,Positif,eat luncheon private room pax round table fine ning good services friendly staff helping taking pictures us rooms service location
4,Hotel Gran Mahakam,Swathi V,5.0,my stay was a combination of quarantine and normal stay easily the best quarantine food i have had so far delightful desserts included too the hotel was not fully open due to covid closure of the spa and limited pool service however everything else was delightful the staff and service was amazing they assisted swiftly on all matters the food at the restaurant was delicious for guests with breakfast options they even had complimentary in room breakfast,Positif,stay combination quarantine normal stay easily best quarantine food far delightful desserts included hotel fully open due covid closure spa limited pool service however everything else delightful staff service amazing assisted swiftly matters food restaurant delicious guests breakfast options even complimentary room breakfast
5,Hotel Gran Mahakam,Yoelto,4.0,good building place location but little lack of parking i felt comfort in the building homey and delicious soto betawi service location more,Positif,good building place location little lack parking felt comfort building homey delicious soto betawi service location
6,Hotel Gran Mahakam,David Lang,5.0,a true star experience the staff is very attentive and helpful the accommodations immaculate and the room service wonderful i d highly recommend if you are staying in south jakarta rooms service location more,Positif,true star experience staff attentive helpful accommodations immaculate room service wonderful highly recommend staying south jakarta rooms service location
7,Hotel Gran Mahakam,Aliya Nursabrina,5.0,classic boutique hotel that is always a favorite love the buffet either for bfast or dinner so much rooms service location more,Positif,classic boutique hotel always favorite love buffet either bfast dinner much rooms service location
8,Hotel Gran Mahakam,Raymond Valiant Ruritan,4.0,i should say that is a small hotel but with agreable service i spent a few times here specially utilizing the restaurant for breakfast and luncheon meetings it is acceptable and well served,Positif,say small hotel agreable service spent times specially utilizing restaurant breakfast luncheon meetings acceptable well served
9,Hotel Gran Mahakam,Exao Original,5.0,room and facilities are standart of normal hotel but the staff are truly amazing very polite helpful the hotel also provide place to perform jumat prayer awesomerooms service location more,Positif,room facilities standart normal hotel staff truly amazing polite helpful hotel also provide place perform jumat prayer awesomerooms service location
10,Hotel Gran Mahakam,Heru Pratomo,5.0,such a great place to staycation i would love to stay again later thx for services breakfast also has a great tasterooms service location more,Positif,great place staycation would love stay later thx services breakfast also great tasterooms service location
11,Hotel Gran Mahakam,T Susatyo,5.0,amazing stars hotel in south jakarta attentive and helpful staff luxurious design super clean room and comfortable bed food was great rooms service location more,Positif,amazing stars hotel south jakarta attentive helpful staff luxurious design super clean room comfortable bed food great rooms service location
12,Hotel Gran Mahakam,Adink,4.0,old hotel maintained well great location tasty breakfastrooms service location more,Positif,old hotel maintained well great location tasty breakfastrooms service location
13,Hotel Gran Mahakam,Anita Harriyanti,5.0,nice place comfort and classy lil bit narrow but the interrior is good,Positif,nice place comfort classy lil bit narrow interrior good
14,Hotel Gran Mahakam,Emma Ewaldsson,5.0,after our hour long flight from seattle to jakarta day quarantine at the hotel was amazing all the pain was paid off great foods friendly staff,Positif,hour long flight seattle jakarta day quarantine hotel amazing pain paid great foods friendly staff
15,Hotel Gran Mahakam,Mida Hardo,5.0,i stayed at gran mahakam for repatriation we stayed for days night as per the current govenrment regulation we felt grateful to get the rooms here the hotel staff we met at the airport was friendly and helpful he helped us to find the local sim card so that we can still continue connected with social media while waiting our pcr result the check in was flawless and very helpfull as we reached there around am only the access to the hotel was a bit confusing at the start due to the regulation the main street was blocked however it got resolved after i called the hotel the reception gave very clear direction to the driver the car was very comfortable they had alphard to pick us up we had a nice sekoteng ginger sweet drink sent to the room to warm us up we rested well and very much pampered by the sophisticated menu selections regular kids menu vegetarian or glutten free menus we mostly ordered indonesian food during our stay i also worked from quarantine the wifi connection is okay few glitches but still acceptable i can ask the hotel to help for printing some important documents everytime we need extra items ie adaptor yoga mat water bottle the staffs will provide it immediately let me share the pictures that will give you ideas why we enjoyed our stay there thanks for everyone there,Positif,stayed gran mahakam repatriation stayed days night current govenrment regulation felt grateful get rooms hotel staff met airport friendly helpful helped us find local sim card still continue connected social media waiting pcr result check flawless helpfull reached around access hotel bit confusing start due regulation main street blocked however got resolved called hotel reception gave clear direction driver car comfortable alphard pick us nice sekoteng ginger sweet drink sent room warm us rested well much pampered sophisticated menu selections regular kids menu vegetarian glutten free nus mostly ordered indonesian food stay also worked quarantine wifi connection okay glitches still acceptable ask hotel help printing important documents everytime need extra items ie adaptor yoga mat water bottle staffs provide immediately let share pictures give ideas enjoyed stay thanks everyone
16,Hotel Gran Mahakam,NATALIA MARGARET THATCHER,4.0,here for a wedding party good wedding gathering space but the parking area is small,Positif,wedding party good wedding gathering space parking area small
17,Hotel Gran Mahakam,Annisa Diana,5.0,one of the most comfortable hotel in south jakarta i love the ambience the cleanliness and how the staff treat us really well i got the room at th floor with citylight view at night the location at blok m is really strategic so we can go everywhere by foot easily maybe due to pandemic they serve basic menu for breakfast so there are not so much variant menu served,Positif,one comfortable hotel south jakarta love ambience cleanliness staff treat us really well got room th floor citylight view night location blok really strategic go everywhere foot easily maybe due pandemic serve basic menu breakfast much variant menu served
18,Hotel Gran Mahakam,davy Sukamta,5.0,the grande old dame this very beautiful hotel located right in the hearth of blok m kebayoran baru designed in art noveau style this boutique hotel provides decent size rooms a pool and several restaurants service is first rate the buffet lunch and dinner is great the bar is cozy and they provides parking space in the basement,Positif,grande old dame beautiful hotel located right hearth blok kebayoran designed art noveau style boutique hotel provides decent size rooms pool several restaurants service first rate buffet lunch dinner great bar cozy provides parking space basement
19,Hotel Gran Mahakam,Achmad Rafiq Kamaluddin,5.0,amazing hotel when we want to see a hotel like in europe we can go to grand mahakamrooms service location more,Positif,amazing hotel want see hotel like europe go grand mahakamrooms service location
20,Hotel Gran Mahakam,Jane Koh,5.0,nice boutique hotel with lots of eateries and street food nearby,Positif,nice boutique hotel lots eateries street food nearby
21,Hotel Gran Mahakam,Ayu Andika,5.0,excellent hotel with good ambience great food love itrooms service location more,Positif,excellent hotel good ambience great food love itrooms service location
22,Hotel Gran Mahakam,Ilham Nugraha,5.0,i enjoy staying at this hotel all food is delicious i could eat more and more because it is so tasty other than that i think it is good for one ot two day stay,Positif,enjoy staying hotel food delicious could eat tasty think good one ot two day stay
23,Hotel Gran Mahakam,Arni Pamungkas,5.0,small but elegant hotel often used for a wedding covid protocols is well applied in this hotel nice friendly staff but the parking lot is limited specially when there s a wedding,Positif,small elegant hotel often used wedding covid protocols well applied hotel nice friendly staff parking lot limited specially wedding
24,Hotel Gran Mahakam,Ambrosius Pin Pin Wijaya,5.0,their service is fast and friendly the variety of the food is very good for dinner a bit limited for breakfast taste is fantastic and the atmosphere is nice and cozy i love my experience here,Positif,service fast friendly variety food good dinner bit limited breakfast taste fantastic atmosphere nice cozy love experience
25,Hotel Gran Mahakam,Putri Nur Indah Pratiwi,5.0,vintage architecture style excellent service and good attitude rooms service location more,Positif,vintage architecture style excellent service good attitude rooms service location
26,Hotel Gran Mahakam,Bagas Danara,5.0,beautiful hotel good room great hospitality rooms service location more,Positif,beautiful hotel good room great hospitality rooms service location
27,Hotel Gran Mahakam,Rike Bewinda,5.0,was here for having lunch with my best friend yes another birthday treat it was good the staff giving a friendly welcome since we come earlier before the restaurant start to open lunch time they have a lot of variation of food yes its from east to west its a complete buffet i love their sushi their vegetables stir fry and their sweet cakes section they also serve local cuisine and dessert love it they also have a nice restaurant room pretty decoration and elegant,Positif,lunch best friend yes another birthday treat good staff giving friendly welcome since come earlier restaurant start open lunch time lot variation food yes east west complete buffet love sushi vegetables stir fry sweet cakes section also serve local cuisine dessert love also nice restaurant room pretty decoration elegant
28,Hotel Gran Mahakam,Jessica Krisanti,4.0,love the decoration inside the lobby and the ambience for cafe is amazing but the downside is the parking area not enough space,Positif,love decoration inside lobby ambience cafe amazing downside parking area enough space
29,Hotel Gran Mahakam,Erika Juanita,5.0,i love love love this hotel this is my first time on the new year staycation but i really love the interior and all circumstances will come back to stay at the hotel gran mahakam definitely,Positif,love love love hotel first time new year staycation really love interior circumstances come back stay hotel gran mahakam definitely
30,Veranda Hotel at Pakubuwono,Shabrina Indah Fitriani,5.0,perfect location easy to get around great ambience friendly service comfy and clean room veranda has a restaurant called wyls kitchen on the ground floor which is really beautiful for weddings or any events spacious parking area reasonable prices,Positif,perfect location easy get around great ambience friendly service comfy clean room veranda restaurant called wyls kitchen ground floor really beautiful weddings events spacious parking area reasonable prices
31,Veranda Hotel at Pakubuwono,Sonny SPH,4.0,beautiful hotel with touch of japanese style locates near to pakubuwono signature the lobby is quite big which could be considered as lounge since has many sofa chairs and tables with beautiful yet unique ornaments the front desk has two areas of table for receiving guests with each has its own chair i occupied two rooms for me and family and the room was nice the most i liked about the room was its bed nice one the restaurant was not big to my opinion but has beautiful theme color of white and space of restaurant could be expanded by using some space next to it of swimming pool area the menu of the breakfast was not so many but complete one the most i like about the restaurant is the taste of its food especially sambal and nasi goreng fried rice the nasi goreng and sambal really delicious and also not to forget its fried noodle the swimming pool was not so big with depth of m but it was good enough and surrounded by green tree and plant and nice flower the hotel has gym area on the second floor which although not so big but has enough equipments and treadmill completed with toilets with clean arrangement the parking lot was small either in the basement and outer area and there was no lift to the basement of parking lot so this could be an issue when going to drop and take the suitcase just make sure you drop off and load luggages on the lobby area still inside the hotel area next to its restaurant there was another public japanese restaurant named sumoji the hotel has small nice veranda on its front area with beautiful flowers and greenery one of my issues beside of the drop off luggages was neither the front office officer nor the restaurant officer seemed reluctantly accepted my payment they seemed would like to delay in accepting the payment overall it was nice hotel and worth staying at thank you to the all hotel staffs especially nadya of the restaurant and the security officers ps i did notice of the security officers in the main entrance they welcoming guest and issuing parking ticket to the management could you give them small chair to sit so they do not have to standing in hours sorry this is just my concern,Positif,beautiful hotel touch japanese style locates near pakubuwono signature lobby quite big could considered lounge since many sofa chairs tables beautiful yet unique ornaments front desk two areas table receiving guests chair occupied two rooms family room nice liked room bed nice one restaurant big opinion beautiful theme color white space restaurant could expanded using space next swimming pool area menu breakfast many complete one like restaurant taste food especially sambal nasi goreng fried rice nasi goreng sambal really delicious also forget fried noodle swimming pool big depth good enough surrounded green tree plant nice flower hotel gym area second floor although big enough equipments treadmill completed toilets clean arrangement parking lot small either basement outer area lift basement parking lot could issue going drop take suitcase make sure drop load luggages lobby area still inside hotel area next restaurant another public japanese restaurant named sumoji hotel small nice veranda front area beautiful flowers greenery one issues beside drop luggages neither front office officer restaurant officer seemed reluctantly accepted payment seemed would like delay accepting payment overall nice hotel worth staying thank hotel staffs especially nadya restaurant security officers ps notice security officers main entrance welcoming guest issuing parking ticket management could give small chair sit standing hours sorry concern
32,Veranda Hotel at Pakubuwono,Piter Halim,4.0,nice and enjoyable close to get anywhere especially to gandaria city mal which only around km only love the swimming pool its quite long and not crowded at all there was nobody at the pool perhaps because i always swim at the morning the room itself neat and clean the aircon is cold cons the internet so damn slow its a shame the hotel with this quality cant provide better connection hopefully in future they will upgrade the bandwith,Positif,nice enjoyable close get anywhere especially gandaria city mal around km love swimming pool quite long crowded nobody pool perhaps always swim morning room neat clean aircon cold cons internet damn slow shame hotel quality cant provide better connection hopefully future upgrade bandwith
33,Veranda Hotel at Pakubuwono,Eric Effin' P - MTB Content,4.0,close to senayan golf and also pim golf it s a good golf hotel for the enthusiastics hotel is well positioned just m away from gandaria city food is good and the surrounding quiet request for pool rooms else the road rooms can be very noisy rooms are good and all works well for those who want to have events there however be prepared for hectic jams because the carpark is relatively small,Positif,close senayan golf also pim golf good golf hotel enthusiastics hotel well positioned away gandaria city food good surrounding quiet request pool rooms else road rooms noisy rooms good works well want events however prepared hectic jams carpark relatively small
34,Veranda Hotel at Pakubuwono,Suhaili Abdul Rahman,4.0,hotel facility seems okay located not too far distant from city center food served also quite good was informed hotel rate also very reasonableservice location more,Positif,hotel facility seems okay located far distant city center food served also quite good informed hotel rate also reasonableservice location
35,Veranda Hotel at Pakubuwono,Rina,4.0,room size is enough for person clean breakfast is great varieties menu room service is over price room to room wall is not soundproof i could heard child voice and peoples talked from room besides if we stay during weekend we can not enjoy the restaurant and pool because there always a wedding ceremony,Positif,room size enough person clean breakfast great varieties menu room service price room room wall soundproof could heard child voice peoples talked room besides stay weekend enjoy restaurant pool always wedding ceremony
36,Veranda Hotel at Pakubuwono,Maria Arasati,5.0,raise the glass for the chef taste of the cuisine daebak for western plate i was there for meeting section but someday i ll stay for vacation service location more,Positif,raise glass chef taste cuisine daebak western plate meeting section someday stay vacation service location
37,Veranda Hotel at Pakubuwono,Dr. Maya Surjadjaja,3.0,i always remember veranda as a great hang out place to chat n dine at the pool side unfortunately the management seems not to care much now food is ok but the setrung was as it isservice location more,Negatif,always remember veranda great hang place chat n dine pool side unfortunately management seems care much food ok setrung isservice location
38,Veranda Hotel at Pakubuwono,Muhamad Fregian,1.0,the hotel employee entered the room before we checked out and because of smoking ash he was fined even though he didn t smoke at all in the roomrooms service location more,Negatif,hotel employee entered room checked smoking ash fined even though smoke roomrooms service location
39,Veranda Hotel at Pakubuwono,kisuk Son,4.0,i think it will be really difficult to find a hotel like this in jkt with same price room was clean and cozy with wooden furniture some star hotels in jkt do not provide aqua dannon as complimentary service but this hotel gives air conditioner waa also good fitness gym was small but still can work out with techno gym products i will recommend this hotel to my friend if my friend want a economical option but only the bathroom there was some moss it can be cleaned with more attention,Positif,think really difficult find hotel like jkt price room clean cozy wooden furniture star hotels jkt provide aqua dannon complimentary service hotel gives air conditioner waa also good fitness gym small still work techno gym products recommend hotel friend friend want economical option bathroom moss cleaned attention
40,Veranda Hotel at Pakubuwono,Bella Rachma,4.0,anothet good hotel to stay in jakarta room was comfy wifi was so sorooms service location more,Positif,anothet good hotel stay jakarta room comfy wifi sorooms service location
41,Veranda Hotel at Pakubuwono,Unnikrishnan Palloor,2.0,services were very poor not getting response from the reception most of the time two times i got plastic paper along with sausage reported to the food serving people other major issue is language few people only speak english airport pick up and air port drop also they promised while picking up from airport but at the time of check out they refused give airport drop service moreover they charged million for nights quarantine no invoice given i will never recommend this hotel to anybody,Negatif,services poor getting response reception time two times got plastic paper along sausage reported food serving people major issue language people speak english airport pick air port drop also promised picking airport time check refused give airport drop service moreover charged million nights quarantine invoice given never recommend hotel anybody
42,Veranda Hotel at Pakubuwono,Kelvin,2.0,im stay for night but ive got room not cleaned the table floor are very dusty the glasses cup and toilet are wet and not cleaned well when check in the reception staff are not very welcome its just bad experiencerooms service location more,Negatif,im stay night ive got room cleaned table floor dusty glasses cup toilet wet cleaned well check reception staff welcome bad experiencerooms service location
